{
  "rrvix_version": "0.1.0",
  "id": "rrvix-example-minimal",
  "version": "v1",
  "title": "A minimal rrvix paper",
  "authors": [
    {
      "name": "rrvix Project",
      "is_agent": false
    }
  ],
  "abstract": "This paper exists as a parser conformance fixture. It contains one claim,\none piece of evidence, one citation, and one open question. Its only\npurpose is to round-trip through rrvix-python's parser into a\nvalid Canonical Intermediate Representation (CIR).",
  "submitted_at": "2026-05-05T17:08:46.441623Z",
  "license": "CC-BY-4.0",
  "topics": [
    "example",
    "conformance"
  ],
  "source": {
    "format": "latex",
    "uri": "file:///Users/blaise/Desktop/blaise-oss/rrvix-dev-workspace/repos/rrvix/tests/conformance/fixtures/minimal/minimal.tex"
  },
  "sections": [
    {
      "id": "sec:claim",
      "type": "section",
      "title": "The claim",
      "order": 0
    }
  ],
  "claims": [
    {
      "id": "rrvix-example-minimal:claim:fixture",
      "paper_id": "rrvix-example-minimal",
      "statement": "A minimal rrvix paper, when compiled by rrvix.cls v0.1, emits a\nsidecar *.rrvix.aux file from which the rrvix parser can produce\na CIR object that validates against cir.schema.json v0.1.0.",
      "claim_type": "theoretical",
      "evidence_type": "argument",
      "replication_status": "untested",
      "extracted_by": "author",
      "canonical": true
    }
  ],
  "citations": [
    {
      "id": "cite-rrvix-example-minimal:rrvix-cir-schema",
      "key": "rrvix-cir-schema",
      "target_url": "https://rrvix.org/schema/v0/cir.schema.json",
      "bibtex_entry": "@misc{rrvix-cir-schema,\n  note = {JSON Schema 2020-12 definition.},\n  howpublished = {\\url{https://rrvix.org/schema/v0/cir.schema.json}},\n  year = {2026},\n  title = {{Canonical Intermediate Representation Schema, v0.1.0}},\n  author = {{rrvix Project}}\n}",
      "is_self_citation": false
    }
  ],
  "annotations": []
}
